videoId,title,channelId,channelTitle,description,publishTime
U-WV0g0rqNI,"Canon R6 Mark II Beginners Guide - Set-Up, Menu&#39;s, How-To Use Camera",UCodu8e6VMhqL_l8Q2MNpdTQ,Jason Hermann,In this Beginners Guide I will be coving the Canon R6 Mark II https://geni.us/vnaPa or https://geni.us/kKxMhW (Affiliate Links) Gear ...,2022-12-27T20:04:20Z
1tnc0Vx3sXU,How To Fly a Drone - Beginners Guide,UCFIRm1Fv1VC4DZxmYyvNOTQ,Jeven Dovey,This video goes through everything you need to know to get started with flying drones. Color Graded with my Drone LUTs: ...,2022-03-29T13:00:02Z
6FvOulppoNw,Best SONY Autofocus settings for wedding photography. Sony A7IV guide for beginners 2022,UCyGgPw6BpG24EW56YYknWVg,Magic Wedding Photographer,This video is sponsored by Narrative - https://select.narrative.so/magic watch FREE FLASH Masterclass: ...,2022-04-06T13:00:15Z
_rLSso560Wc,Top 3 Drone Mapping Tips for Beginners | DJI Mavic 3 Enterprise,UCEAiO2pWihna98dJB20fM-w,Drones Down Under,Shawn and Danny break down the top 3 drone mapping tips every beginner should know! ✓ Perfect your aerial mapping ...,2025-05-04T04:13:42Z
MIfPLRnsi54,How to use a DSLR Camera/ Canon 1300d for beginners 🔥,UC_mGOFzB2TAAAtUTkW8ZNnA,Blackglass Reviews,,2023-10-21T09:01:33Z
vlfOJIOW5KY,FUJIFILM X-E4 Beginners Guide &amp; My Settings (AF Switch Solution!),UCcyHGNAjMTWAJ_ztX8JbGgQ,Samuel Streetlife,A beginner guide for the Fujifilm X-E4 to help you understand and set up your X-E4! I am also going to show you my custom ...,2021-03-05T19:51:34Z
9gek_fnHQhg,How to shoot in manual mode |  Beginner camera tutorial | Tamil tutorial,UCqYO6rLvJUi91Z27jR6Pc0w,Andrew  Issac,"I taught about the basics of photography in Tamil. You will learn about the exposure triangle (shutter speed, Aperture, ISO).",2022-05-12T16:45:00Z
2BM4lZa2LTI,Blackmagic Camera App Basic Settings Walkthrough for Beginners,UCso1B56GyEtnhn2OPENKXoQ,Doc Rock,Master the Blackmagic Camera Settings on your iPhone with this comprehensive tutorial! Whether you're shooting content for ...,2024-12-12T08:12:48Z
60S1RhDXbzs,&quot;How to Shoot CINEMATIC Videos | Complete Filmmaking Tutorial for Beginners&quot;   #shots,UC2VHGtuW801CD-hxO5kJXHw,FX Hossain,Cinematic Tutorial | Learn How to Create Stunning Visuals Unlock the secrets of cinematic filmmaking in this in-depth tutorial!,2025-05-04T12:21:53Z
20HuTp1fgHo,"📹Photography Basics for Beginners | Camera Settings, Angles &amp; Tips in Hindi🔚#short #tranding #reels",UCYEBO22ioA1Zlo7ZH2BHFWw,Mr sigma,,2025-05-03T10:52:23Z
P4xJziPR0Go,How to Photograph a Surprise Proposal | Photography Tips for Beginners,UCHIRBiAd-PtmNxAcLnGfwog,B&H Photo Video Pro Audio,"Go behind the scenes with Maria as she photographs a surprise proposal. She'll show you her camera gear and settings, as well ...",2020-09-04T15:00:12Z
VENAGLV9EJM,DJI OSMO MOBILE 6 TUTORIAL for Beginners: How to Setup and Use Features: FULL GUIDE,UCxDJbNtgLYUwjPg_xYjvSwQ,Otto Julian,"DJI OM6 / Osmo Mobile 6 Smartphone Gimbal easy step by step Tutorial. FULL Guide, how to use MIMO APP, how to setup, ...",2022-12-29T20:09:25Z
tFUTbeLb7F4,How to Use Shutter Speed in 1 Minute - Videography for Beginners,UCDqBrpwgeLkQsV5lPyXeUHA,Filmrunners,How to Use Shutter Speed in 1 Minute - Videography for Beginners Cinematography tutorial in less than 1 minute for beginners ...,2022-03-02T17:00:56Z
VEJ9tkqUYVw,How To Use Your iPhone 16! (Complete Beginners Guide),UCy1PnKNVtEG-SfSzyIfnvrA,Simple Alpaca,Get The Cheapest iPhones Here: https://amzn.to/3JTnWAr Get The Cheapest Androids Here: https://amzn.to/3r2k1st Wallpapers I ...,2024-09-21T21:00:13Z
DLllLVWEXXo,Beginners Guide To iPhone 16 - How To Use iPhone 16 Pro Max Tutorial,UCUZursSUsd-NxcE6BquDnwQ,DHTV,"Welcome to the Beginners Guide to iPhone 16, where you will learn how to use the iPhone 16 Pro Max like a pro. This iPhone 16 ...",2024-09-24T20:55:34Z
NZzd8GcCxYc,GoPro Hero 13 Black BEST Settings + Setup Guide for Beginners,UCxkon1bdwHuR1XJgCFcEk-Q,Gemini Connect,Let Clickup help you get more done than 99% of people. Go to https://tryclickup.co/gemini and use my code GEMINI to get started ...,2024-11-19T13:00:26Z
F_DXXrcWRv8,Sony ZV-1 II Beginners Guide - How-To Use the Camera In Detail,UCodu8e6VMhqL_l8Q2MNpdTQ,Jason Hermann,In this highly detailed tutorial/ how-to users manual I will be covering the new Sony ZV1 Mark II https://geni.us/HusY or ...,2023-06-05T17:08:22Z
avkRMGCWTqw,Beautiful bokeh on your camera 📸 Settings for beginners,UC2GiR8twBxnP76xK8IUcLsw,Elena Bazu,More photo stories on Instagram http://instagram.com/elenabazu My classes about photography https://elenabazu.gumroad.com ...,2022-07-12T15:30:00Z
XF5tMiy4AAs,DJI Osmo Mobile 7 Beginners Guide - Start Here (&amp;7P),UCFIRm1Fv1VC4DZxmYyvNOTQ,Jeven Dovey,"Want to learn filmmaking, go on adventures and grow on YouTube. I built a course that teaches you all that. 30 Days to Become ...",2025-04-05T18:03:35Z
KPd584OywsU,GoPro Hero 11 Settings Guide for BEGINNERS | EASY TO FOLLOW + Set Up Your Camera,UCBQccKApVf8hfTbumKTjHwQ,Jake Rich and Anna Chah,Epidemic Sound OFFER: https://bit.ly/3gmdRSI Action Camera Masterclass: https://geni.us/x2s4F Grab GoPro Hero 11: ...,2022-11-24T19:36:44Z
So3kBPMxMmY,Camera Mechanics &amp; iPhone Camera Settings – Class 2: Digital Photography for Beginners (Week 2 of 6),UCwNaNIAORt7ukZpzHQ1AD9Q,Ms. Polly Teaching,"Welcome to Class 2 of our Intro to Digital Photography for Beginners class! Whether you're shooting with a DSLR, mirrorless ...",2025-04-16T20:28:21Z
04qrt2nG8wI,My Top Canon Cameras for Beginners!,UCaErB8MpypFl2BOxEUbToZQ,THE CAMERA HACKS M2,,2022-03-01T02:36:21Z
zv9YL5gDhv8,BEST Camera Settings For Aviation Photography !,UCL0CykAC1D6Pz8KJHVK1eIw,TCM Reviews,"QUICK CAMERA SETTINGS FOR JET AEROPLANES AND AVIATION SHOWS ✈️   Want to capture stunning, high-speed ...",2025-05-06T17:32:44Z
7gZgWNndDpw,Sony a6000 SETTINGS for street PHOTOGRAPHY - For BEGINNERS,UCz9ZNbS69NE1jFwJukxn0eg,Squidmans Jensen,"NOTE *AF DRIVE SPEED IS ONLY FOR VIDEO, MY BAD and the picture profiles are for video AND JPEG, not Raw Files Sony ...",2021-07-21T10:45:00Z
2Za_X2kNP98,DSLR Camera Complete Guide : Types Of  Camera  Modes Explain In Telugu | 2020 By Telugraphy Harsha |,UC1IN19XXnDnJ06pQOYZG8Og,TELUGRAPHY HARSHA,photography #cameramodes #telugraphy_harsha DSLR Camera Complete Guide : Types Of Camera Modes Explain In Telugu ...,2020-07-19T03:09:09Z
npq8Nu-JNBI,3 Camera Techniques Used in Movies For Beginners (Part-1) #shorts,UCCwt6PDivCeJ9dnQz5jtIqQ,KamalPreet Singh,3 Camera Techniques Used in Movies #shorts BEGINNER TO PROFESSIONAL EDITING COURSE ...,2023-01-22T07:22:40Z
fRqEYmBo25E,Sony a6000 Best Video Settings For Beginners | Complete Video Settings Guide,UCJja0_rtfD8bNlyYD7D9TsA,Adam Harig,In this video I give a basic walkthrough of the best video quality settings for the Sony a6000. This tutorial is intended for beginners ...,2022-10-13T22:16:12Z
rPC65Xq0j6A,DJI NEO | Complete Beginners Guide + Best Settings (Updated 2025),UCJQjhL019_F0nckUU88JAJA,The Drone Creative,Epidemic Sound FREE 7 Day Trial - https://share.epidemicsound.com/tdcSEP24 GET 25% OFF USING CODE: TDC25 (Limited ...,2024-09-19T17:18:14Z
7TJs_AHTf-A,What settings to use for beginners flash photography - Godox TT350,UCPRbWHZG_57wtZG683murVw,Comsteria,"If you want to improve your product photography for your e-commerce website, using and external camera flash can really make a ...",2022-12-20T13:01:55Z
bTH55Q0ddrA,Best Manual Settings For Beginners | Outdoor | Tamil | Trending Photography #dslr #trending #tamil,UCUQVa_XRgV5QBVBXMa_ZxBA,Trending Photography Tamil,Welcome Back Dears ! Please one help for me ? - Hit Subscribe & Like ! Thankyou for watching in this video ! This is your channel ...,2022-11-28T10:36:32Z
b2SDQcZ8Qys,Sony FX30 Beginners Guide - How-To Use The Camera,UCodu8e6VMhqL_l8Q2MNpdTQ,Jason Hermann,In this highly detailed tutorial I will be covering the powerful Sony FX30 https://geni.us/Jxd4 or https://geni.us/MdRiTq (affiliate ...,2023-01-11T11:24:03Z
2KINgySh1Ps,Panasonic Lumix G9 II Tutorial - Everything You Need to Know for Beginners,UCeNurSO_Jci6LChLzxBj3oA,Geeky Nerdy Techy,"Welcome to my free tutorial guide for the Panasonic Lumix G9 II camera. If you've just purchased this camera, this beginner's ...",2023-09-16T23:30:01Z
vaxoJMEn7fU,How To Use Your iPhone 16 Pro/iPhone 16 Pro Max! (Complete Beginners Guide),UCy1PnKNVtEG-SfSzyIfnvrA,Simple Alpaca,Get The Cheapest iPhones Here: https://amzn.to/3JTnWAr Get The Cheapest Androids Here: https://amzn.to/3r2k1st Wallpapers I ...,2024-09-23T17:00:41Z
_-7IM82kAlg,DJI MINI 3 Beginners Guide - Start Here!,UCFIRm1Fv1VC4DZxmYyvNOTQ,Jeven Dovey,Graded with these Drone LUTs: https://geni.us/BqN1X Learn How to be a Creator Here: https://geni.us/JBQq9m ➡️ Get the ...,2022-12-10T14:00:16Z
bheMRqCXUME,Canon R7 Tutorial Training Overview Set Up - Part 1 - Made for Beginners,UCFIdYs7n4i8FKEb0aYhOucA,Michael The Maven,"MAVEN Color Coded Photography & Videography Filters - Wave 2 Introducing Dark Polarizers, Variables, Graduated NDs, ...",2022-06-29T01:45:06Z
ZUTFGXP_3eE,How To Fly Drone For Beginners #shorts #drone,UCGWmR60r2VLhCgmWW6u64NA,DADDY DRONES,,2024-10-19T10:05:27Z
jRk0Ff9X278,HOW To FREESTYLE In ROCKET LEAGUE | Controls &amp; Camera Settings (Beginners Guide),UCyL13WCbRel2iWmNqpEpnOg,MrSalty,HOW To FREESTYLE In ROCKET LEAGUE | Controls & Camera Settings (Beginners Guide) This video will teach you HOW TO ...,2021-11-06T10:58:30Z
sbEHUDTaBGI,Canon R8 || How To Video Shoot  for Beginners📸😍🔥||English Subtitle #short #shorts #viralshorts,UCNmEsdbi7D0rocthV-t2Tgg,Photography Tips And Tricks ,Canon R8 || How To Video Shoot for Beginners      ||English Subtitle #short #shorts #viralshorts Your queries:- canon r8 canon ...,2024-09-12T11:54:46Z
XzX7xjRjxgs,Sony ZV-E1 Beginners Guide | Set-up &amp; How-To Use The Camera,UCodu8e6VMhqL_l8Q2MNpdTQ,Jason Hermann,In this video I will be covering the Sony ZV-E1 Beginners Guide Style which will show you how-to set-up and use the camera.,2023-06-25T14:00:16Z
Up1e1RaM8Yk,Best SONY FX3 Run and Gun Settings for Beginners,UCoI5MRIeoC5f4Wjx17X1zkQ,Mark The Cre8tor,"In this video, I step through the steps I use to set up my Sony FX3 to recall the most used settings for Run and Gun type situations.",2023-08-25T16:00:22Z
EExVFVAZlb8,3 best camera for beginners photography and videography 🔥🔥#shorts,UC8jZEMgwMbXu9pZGLHD140g,Vlog by Rahul,3 best camera for beginners photography and videography #shorts.,2022-04-20T10:49:32Z
kdVPpOmAfJQ,A Beginners guide to Canon 550D,UCzJS1bqc3k7XdboZKBm1OyQ,Claudia Brookes,,2016-06-17T13:48:33Z
AiBXibK-Nyk,GoPro Hero 13 Black: The Complete Beginners Guide,UC6y_DbpezOinlzHv8O092zw,DC Rainmaker,"Here's your complete GoPro Hero 13 Black Beginners Guide, diving into all the new features of the Hero 13 Black, from someone ...",2024-09-08T21:51:46Z
emdzf0ceSp4,Best One-Light Off-Camera Flash Setup for Beginners | Easy Photography Lighting Tutorial 📸,UCaz57A9UmjTE5Shqs7pbaYA,Florian Frickel,"In this video, I share my thoughts on the best flash photography kit for beginners, including my top recommendations for getting ...",2023-11-20T14:00:23Z
kfYp_t9P490,Sony ZV-1 II Tutorial - A Quick Start Guide For Beginners,UCodu8e6VMhqL_l8Q2MNpdTQ,Jason Hermann,In this video I will get you up and running with your new ZV1 Mark II camera as fast as possible from a beginner perspective.,2023-05-24T14:53:30Z
crmN3Hvc8WA,Panorama Photography for Beginners - Camera Settings and how to stitch and edit the perfect pano.,UC9lyUdwosxq_OxC1uggjUPA,Photo Genius,"In this video we show you how to capture a landscape panorama with tons of tips on gear, camera settings and how to edit and ...",2020-01-24T12:06:07Z
g2X40zbGTCo,Insta360 X5 Beginners Guide and Tutorial,UCoKMBuQ8YejlCbNm77ZL8jg,Air Photography,This is my beginners guide and tutorial for the new Insta360 X5. In this video I go over the basic functionality of the camera and ...,2025-04-24T13:49:40Z
b14FE8qAx8c,DJI OSMO MOBILE 6 | Complete Beginners Guide + Best Settings,UCJQjhL019_F0nckUU88JAJA,The Drone Creative,The BEST MUSIC For Smartphone Videos!! (FREE TRIAL): https://share.epidemicsound.com/lblns0 Find out more info about ...,2023-07-24T19:05:22Z
WyfheHjf6sQ,Sony A7 IV  #1 : Camera Button &amp; Function | Beginners Guide | जाने सभी फंक्शन ( Hindi ),UCxG5J9YJdAYUbN_ycenK5eQ,RJ Tech Buddy,Sony A7 IV Tutorial : Camera Button & Function | Beginners Guide | जाने सभी फंक्शन ( Hindi ) #sonyalpha #sonya7iv ...,2023-02-15T13:30:08Z
af4TqWztnnw,DJI Osmo Action 4 | ACTION CAMERA TIPS for Beginners,UCaLCRvvau4acqQ4eLGZUywA,JORDAN HETRICK,Just got your DJI Osmo Action 4 action camera? Bestselling author Jordan Hetrick answers some of the most common beginner ...,2023-11-01T19:23:35Z
DjvcEWxzTxY,Olympus Video AutoFocus Settings for Beginners Part 2 ep.170,UC4k4g9LVWmGOidD7tzRnYFg,Rob Trek,"Demonstrating the Olympus video autofocus settings and how to use them while recording video. Also, a weird Olympus setting ...",2019-06-19T11:02:24Z
uXbLOoVMUd0,something new camera 😱 nikon z6 mark ii || beginners photoshoot camera || #shorts #nikon #ytshorts,UC3spDmCvqkZHDCsgMWCzFtw,Kaimur Photography,something new camera nikon z6 mark ii || beginners photoshoot camera || #shorts #nikon #ytshorts #photography ...,2023-02-23T03:30:17Z
iRxhR9j3aRA,DJI Osmo Action 5 Pro Beginners Guide - Start Here,UCFIRm1Fv1VC4DZxmYyvNOTQ,Jeven Dovey,Graded with these Adventure LUTs: https://geni.us/BqN1X Learn how to be an Adventure CREATOR: https://geni.us/2h9Gzi ...,2024-11-21T14:00:42Z
oFH-DHjINQM,Beginners Guide to On Camera Flash Photography- Godox TT685II,UCaz57A9UmjTE5Shqs7pbaYA,Florian Frickel,"In this video, we'll walk you through the basics of on-camera flash photography, helping beginners understand how to get started ...",2023-12-17T17:00:35Z
7h4D184s2q0,"Sony ZV-E10 II Beginners Guide Tutorial | How-To Set-up, Menus, And Much More!",UCodu8e6VMhqL_l8Q2MNpdTQ,Jason Hermann,In this video I will be covering the powerful Sony ZV-E10 II https://geni.us/g8tlY59 or https://geni.us/TfirUL (Affiliate Link) Beginners ...,2024-08-01T12:18:30Z
DtHsWCwo5Mo,Canon EOS R User&#39;s Guide | How To Set Up Your New Camera,UCZG-C5esGZyVfxO2qXa1Zmw,Jared Polin,NEW FroPack 1 Lightroom Presets https://froknowsphoto.com/presets/ (40% off) Table Of Contents for the Canon EOS R Users ...,2018-11-18T22:34:45Z
vp_eKJ1mFJI,DJI OSMO POCKET 3 Beginners Guide - Start Here,UCFIRm1Fv1VC4DZxmYyvNOTQ,Jeven Dovey,Get a DJI Osmo Pocket 3: https://geni.us/JqZeSz Learn How to be a Creator Here: https://geni.us/JBQq9m Graded with these ...,2023-10-29T13:38:25Z
-6sJlm16c64,Master Aperture like a Pro -  Cherry Blossom |  Focal Length | Camera Settings,UCQm0Q1BR1cId8fr6pYBhjXw,Travelbugraphy,"How to capture cherry blossoms? My name is Osk, I'm a multi-genre photographer and content creator. Let's Connect ...",2025-05-01T07:13:17Z
F1yly2Kjh3Y,DJI MIC 2 Beginners Guide - Start Here,UCFIRm1Fv1VC4DZxmYyvNOTQ,Jeven Dovey,The Complete Beginners Guide for the DJI MIC 2 ➡️ Get the DJI MIC 2 here: https://geni.us/y6JeA Graded with my Adventure ...,2024-01-17T13:00:09Z
9zqTsXh4c4U,best vlogging tips for beginners | #shorts #techbengalishorts,UC63hr7gtmf7kvV0qef0EgLQ,Tech Bengali Story,My First Vlog | | #shorts #techbengalishorts #shorts #techreels #mobilephotography #vlog #vlogging. Business mail ...,2023-03-05T16:53:55Z
aO_ceeiGHuw,Cinematography Deepdive for Beginners - Camera and Render Settings Tutorial - Unreal Engine 5.5,UCCFtRUUmfWqkRz3KJtBs9zA,The Darkest Age - Unreal Engine Filmmaking,This is a tutorial showing the basics of how cameras work and relate to cinematography in Unreal Engine 5. I go over the basic ...,2025-03-18T02:33:13Z
yCMdj7B8WiA,How to Use OBS Studio - Complete OBS Studio Tutorial for Beginners (2023!),UCO4Nw0vUpxgb0zsziJ1SaMg,Primal Video,Learn how to use OBS Studio like a PRO in this step-by-step OBS Studio tutorial for beginners. Find out why Open Broadcaster ...,2023-07-13T04:00:27Z
3nu0tsj1oNk,Insta360 X3 360 Camera Ultimate Beginners Guide - Beginner To Pro In Less Than 30 Mins,UCeqky0tc84Ezl0CYMW3xKkA,Best360,FREE DOWNLOADS ➡️ Insta360 X4 Best Settings Cheat Sheets: https://bit.ly/4lioClh ➡️ Insta360 X3 Best Settings Cheat ...,2022-10-12T14:14:38Z
V628RfUe6vI,DJI Osmo Action 5 Pro Beginners Guide - Getting Started,UCoKMBuQ8YejlCbNm77ZL8jg,Air Photography,This is my beginners guide for the DJI Osmo Action 5 Pro to help those who have never used an action camera before get ...,2024-10-13T12:18:33Z
_E4TPlRNFys,Sony FX3 time lapse settings for beginners in under 5 minutes,UCoI5MRIeoC5f4Wjx17X1zkQ,Mark The Cre8tor,This video is a quick and easy way to set up the Sony FX3 to shoot a timelapse using the S&Q mode. I use this all the time when ...,2023-04-10T23:00:12Z
RezNh9TllJc,Best OBS Studio Settings for RECORDING in 2025 (For Beginners),UCK2Kdh5cnoVoIfu8i6Wh2Tw,Cpaws Music,FREE STREAMER'S MASTERCLASS▹ https://go.cpawsmusic.com/masterclass STREAMER STARTER PACK (20% OFF)▹ ...,2024-11-01T14:03:00Z
G0ZyR2A4TO0,Moon Photography with a DSLR | Astrophotography for Beginners,UCXf5yWqfydi3RR927ZPtGaA,SarahMaths Astro,"I teach beginners how to photograph the Moon with a basic astrophotography setup. We then process the images using Siril, ...",2023-07-06T18:28:57Z
r2WPaowQbn4,BEST Settings for Northern Lights lights Photography | Beginners Guide,UCRRejN1io5iVMnachaLM2JA,Matthew Storer,"Here are the BEST settings for Northern Lights Photography, an ULTIMATE BEGINNERS GUIDE. Ever dreamt of photographing ...",2019-12-29T11:00:08Z
k3SBcPTDiYs,Sony ZV-E1 Setup Guide - Beginners Start Here!,UCNq_6MwbXuGnrHqQVkRJIYQ,Sidney Diongzon,"Get the Sony ZV-E1: https://geni.us/nrQ0 - Also, download my FREE Sony ZV-E1 camera settings: https://geni.us/SDZVE1settings ...",2023-06-08T18:17:29Z
YXCHi0Uo2Ew,Intro to Camera Raw - Photoshop for Beginners | Lesson 11,UCMrvLMUITAImCHMOhX88PYQ,PiXimperfect,Join PiXimperfect Pro - The Ultimate Photoshop Training Course: https://pix.live/pro Discover the most powerful tool in Photoshop ...,2023-10-29T16:22:06Z
QeVAAOoXzCc,DJI Osmo Action Tips &amp; Tricks for Beginners,UCoKMBuQ8YejlCbNm77ZL8jg,Air Photography,I have put this tips and tricks video together to help those who are brand new to the DJI Osmo Action get familiar with their new ...,2019-05-24T14:30:01Z
sBGKyZeLfX0,"YOUTUBE FILMING SETUP AND EQUIPMENTS FOR BEGINNERS (CAMERA, LIGHTING, CAMERA SETTINGS, AUDIO,)",UC1-P81CJbTJx6YeHNvNbCJw,kelechi mgbemena,"Hey love, in this video i show you how i set up my filming Equipments MY FILMING SETUP EQUIPMENTS Camera; Canon Rebel ...",2017-12-10T18:54:16Z
M99hrZFG9ko,DJI Osmo Action 4 Beginners Guide &amp; Tutorial,UCoKMBuQ8YejlCbNm77ZL8jg,Air Photography,DJI Osmo Action 4: https://bit.ly/3qbgtHT This is my beginner's guide for the new DJI Osmo Action 4. This training guide is ...,2023-08-22T18:20:39Z
9z9GiEM4uvA,How to Use OBS Studio - Complete OBS Tutorial for Beginners (2025!),UCO4Nw0vUpxgb0zsziJ1SaMg,Primal Video,How to use OBS Studio like a pro! Here's our step-by-step OBS tutorial for beginners so you can get up & running with this ...,2024-12-10T04:00:08Z
0k0HO9dHezA,Nikon Z50 Tutorial : Camera Button &amp; Function | Tutorial for Beginners । जाने सभी फंक्शन Hindi,UCxG5J9YJdAYUbN_ycenK5eQ,RJ Tech Buddy,Nikon Z50 Tutorial : Camera Button & Function | Tutorial for Beginners । जाने सभी फंक्शन Hindi #nikonz50tutorial ...,2022-02-07T13:30:00Z
bG1HwiLr1SM,Insta360 X3: Beginners Guide &amp; Best Settings,UCUFJyy31hGam1uPZMqcjL_A,The 360 Guy,CHECK OUT MY NEW INSTA360 VIDEO COURSE. FIRST 50 SIGN UPS FROM YOUTUBE GET 50% OFF: https://bit.ly/3Ytv5it If ...,2022-10-19T12:30:46Z
R295TN3v6sk,BEST OBS STUDIO AUDIO SETTINGS FOR BEGINNERS 2025✅,UCK2Kdh5cnoVoIfu8i6Wh2Tw,Cpaws Music,OWN3D PRO STREAM OVERLAYS▹ https://www.own3d.pro/en/?deal=cpawspro ➡️ FREE STREAMER'S MASTERCLASS▹ ...,2023-03-24T17:30:04Z
idFRHEbYp8Q,10 Gimbal Moves To Make ANYONE Look EPIC! Filmmaking Tips For Beginners,UCWWq67D7TofEPq_eBiaYCWw,Learn Online Video,"In this video, learn 10 EASY gimbal moves to make ANYONE look epic! GEAR USED IN THIS VIDEO: Zhiyun CRANE 2S: ...",2020-10-23T08:30:24Z
2KiKq8bF570,How to Change the Camera View in NBA 2K24 - For Beginners,UCsyrE2v4P_rJAlvKnpsW9RA,JugZone,How to Change the Camera View in NBA 2K24 - For Beginners If you are wondering how to play and need some tips to get better ...,2023-09-11T12:43:16Z
yaN5Z20YEj4,"Shoot smarter, not harder, edit faster, shoot like a pro.",UC69h8E48cJ-AQhwSZ9ojKCQ,Video Pro Solutions  ,Getting it right in camera will save you time in post Want to spend less time fixing mistakes and more time creating masterpieces?,2025-04-22T21:03:45Z
hTMF_km17F0,Canon 1500d Total Camera Settings for Beginners in Telugu #photography #canon #trend #sub#viral,UCqoWoTrXiGNQiva2dN12vQQ,TheLifeOfBobby,,2023-12-28T08:41:32Z
zCzBDFrHXgU,5 Street photography tips for beginners and camera settings | Hindi tutorial,UCXlIvD6MtbHB7YhP3vudmHQ,Maneesh Saxena,In this Hindi tutorial for beginners photographer we explained 5 street photography tips and camera settings to achieve great ...,2018-04-27T17:08:10Z
iEJbY29eRuU,Canon EOS 700D Full How To Use | Beginners Guide in Hindi | How to Use DSLR | Full Tutorial |,UCnQo56eYqiNKczzPJHU1XtQ,Bhavishay Marwaha,In This video I have demonstrated to you how to use any DSLR camera in my case it is a Canon 700D Learn How To Use Canon ...,2024-05-07T11:45:02Z
GyhJeNRjlHY,BGMI Sensitivity Explain For Beginners And How Can U Make Your Own Sensitivity @FaithPlayzZzYT,UCJ3AFR_J7fmKfYgGkPD-fVw,Faith PlayzZz,"Hey Guys, Welcome to my Youtube Channel, I'm FAITH, Device - REALME GT 2 I upload videos regarding Tutorials for BGMI, ...",2024-05-11T08:00:56Z
qYpMIYsALtw,Microsoft Flight Simulator 2024 - 10 Beginners Tips And Tricks You Need To Know,UCXa_bzvv7Oo1glaW9FldDhQ,GamingBolt,"Launch issues aside, there's no doubt Asobo Studio's Microsoft Flight Simulator 2024 is an absolutely massive experience.",2024-11-22T20:00:32Z
oFX-PQJBPRA,DJI Mini 4 Pro: The Complete Beginners Guide,UC6y_DbpezOinlzHv8O092zw,DC Rainmaker,"Here's your complete user/beginner guide to the DJI Mini 4 Pro, with everything you need to know based on real-world usage and ...",2023-09-30T08:57:05Z
tn7A950EMuY,3dsmax vray physical camera settings for beginners - hindi bhasha,UCOiAOLSyQdASrn3cVi4-VNw,3D CREATIVES,3dsmax vray physical camera settings for beginners - hindi bhasha FROM THIS TUTORIAL WE WILL LEARN: 1.3dsmax vray ...,2019-08-13T15:58:38Z
GArCC4LYKlc,insta360 GO 3S Tips and Tricks for Beginners,UC2AIcl7rNtUvAwE6ATal2eQ,Eat Sleep 360,The first 500 people to use my link https://skl.sh/eatsleep36001251 will get a 1 month free trial of Skillshare! This video shows you ...,2025-01-16T14:14:12Z
Dy3xVuIED9c,DJI Air 3S - 44 Tips &amp; Settings: The Complete Beginners Guide,UCa10m04VDy8yJghT3eJET9Q,DansTube.TV,"The DJI Air 3S is packed with exciting new features and in this video, I showcase 44 of the most important tips, tricks and settings.",2024-10-16T12:20:06Z
WecziaqwS48,Canon 7D for Beginners Optimal Setup by Vitamirus,UCNVojm2P-avfM6oAO8Z2o8g,Vitamirus,Ever finished a shoot and found you had the wrong settings on the camera? Here I show an optimal setup I use on the Canon 7D.,2011-10-24T12:14:30Z
sLh4dufEQD8,Quick Beginners Guide to Sony FX30 Settings,UC8qLt3u_D2t9c9033HZEQnQ,Mike B Salazar,Sony FX30 changes and walkthrough that I've applied to my own camera to give you a better idea of what combinations that you ...,2022-11-21T10:00:28Z
yKWeoWO2-Ws,How To Reset Or Restore Camera Default Settings On iPhone - For Beginners,UC56Q9-3M5enLgZW4ZwDqKkw,Fix Your Apps,How To Reset Or Restore Camera Default Settings On iPhone Sometimes the iPhone camera might not perform the way it used to ...,2025-05-11T09:01:22Z
qjAt3W2py-Y,Beginners guide to controlling camera views and custom views in Microsoft Flight Simulator 2024,UCUnp7jVjuXsM2cFW5JNFR0A,Jonathan Beckett,"A quick guide showing how to move around, and save and load custom views in Microsoft Flight Simulator 2024. Postscript - there ...",2024-11-26T10:30:51Z
O419Vu5v0VU,Low ISO vs High ISO — What’s the Real Difference?,UCq75kFFD7e4ArjzYaFyqLDQ,JoeyP Visuals,"Ever wonder why some photos look clean and others are full of grain? In this video, I compare low ISO vs high ISO settings and ...",2025-05-12T18:24:23Z
yXp2c5vVFus,DJI Osmo Mobile 7P TUTORIAL Guide for Beginners: How to Setup and How to Use,UCxDJbNtgLYUwjPg_xYjvSwQ,Otto Julian,"Best Tutorial for DJI OM7P, Osmo Mobile 7 (DJI OM7) Step by Step for beginners. FULL Guide on how to use tracking sensor ...",2025-03-06T14:01:18Z
YgYJn6YJMyg,Olympus Menu Video Settings Walk Through for Beginners Part 1 ep.169,UC4k4g9LVWmGOidD7tzRnYFg,Rob Trek,This is Part 1 in a series on how to do video with Olympus Cameras. A walk through the Olympus menu video settings for ...,2019-06-18T12:18:37Z
86zlCZhaoR0,Mobile Photography Tips for Beginners: How to Take Amazing Photos (Hindi),UCeRR3gl2xCB68ZO7O_z7cmA,Kunal Malhotra,Learn Photography with me: https://bit.ly/kunalmalhotraYT 📽️ Adobe Lightroom Masterclass: https://bit.ly/LightroomWithKM ...,2023-11-04T11:30:06Z
e_TRPbGVhDc,Fujifilm X-T5 Setup Guide BEST Settings For Beginners,UCtz0QiZ0ZVnqxue_0MEGXJA,Tudor Mateescu,"If Fujifilm X-T5 is a photographer camera, than this setup guide full of photography settings is for you! Consider joining my channel ...",2022-11-24T16:01:17Z
00_9F2WjVZ4,"How to find, setup. photograph and edit your mushroom photos, a beginners guide.",UCtNYuGlqr1cZEyAVNqdzTnw,Keith Guppy Photography,"In this beginners guide to mushroom photography, I talk you through how and where to find mushrooms, how I compose my ...",2022-10-26T09:00:00Z
