videoId,title,channelId,channelTitle,description,publishTime
CpvnIvCtQ9s,"The BEST Fortnite Aimbot Settings you will need THIS Season!🔥 (PS5, XBOX, PC, SWITCH)",UCqq90mrL_x3SKW4MxJUGjdw,Zams,"1v1 map with my settings: 7263-9510-1289 Socials: Twitter: https://x.com/008bug Code: ""wgcbug"" in the Item Shop!",2025-05-04T13:18:47Z
ovq1-5nuMvo,Canon 80d best settings for beginners,UCSE3iiXkS96WXjw9Xqj2law,arbaz khan,,2024-03-01T15:42:15Z
XumDynEidm8,New Sony ZV-E10 II is Game Changer for BEGINNERS,UCW_EQERE-3EuqDxF9vj0bBA,AniThing,"Hi, Ani here. Sony zv-e10 ii might be the best budget mirrorless camera for beginners, period. Sony zv e10 mark ii is way ...",2024-11-17T06:30:14Z
B2a0fs9brAE,"Canon V1 Beginners Guide - Quick Start, Then How-To Everything..",UCodu8e6VMhqL_l8Q2MNpdTQ,Jason Hermann,"In this video I will be covering the new Canon V1 Beginners Guide Style. Gear used linked below and thanks for watching, Jay ...",2025-05-11T22:17:03Z
CJthSRADbtc,Xperia 1 ii Photo Pro Tutorial (PERFECT for BEGINNERS!),UC5Z255S1RGBxltLwxq1qHeQ,James Lavish,Xperia 1 ii Photo Pro Tutorial (PERFECT for BEGINNERS!) #sonyxperia1ii #sonyxperia1iicamera #xperiaphotopro Looking for an ...,2020-09-04T13:45:48Z
6hgnPxJ5i1Q,BEST Beginners Settings in truckers of Europe 3,UCpEx9EZLq5H3BnkXpltr6vg,Dwaytec,Here's a recommended setup to start your trucking journey in truckers of Europe 3 Best settings for beginners #truckersofeurope3 ...,2024-02-10T16:53:23Z
ZVZC4V1nnKI,Studio Photography for Beginners + Lighting and Camera Settings | Behind the Scenes,UCmzx_b27YXKXscSn22mkRSg,Ronnix Photography,"Studio Photography for Beginners + Lighting and Camera Settings | Behind the Scenes In this video, i will demonstrate how to ...",2025-02-18T16:43:25Z
0lHNHR74W_Y,"DJI Osmo Action 5 Pro Beginners Guide – Master Your Action Camera, FAST!",UC-46OxZnJZM0Hz8t9OE7_Ww,MK - Creator,DJI Osmo Action 5 Pro complete beginner's guide. In this beginners tutorial I'll walk you through everything you need to know to ...,2024-09-22T13:44:20Z
s8i9RzJc9Mc,Motovlog Setup for Beginners: Gear &amp; Settings,UChGvYWzxAr4yTMp-0uh0i-Q,Grease's Garage,"Are you looking to capture your chopper ride footage and share it with the world? In this tutorial, I'll walk you through the essential ...",2023-10-06T13:53:27Z
0-RuFcjny5A,Ring Video Doorbell - Complete Beginners Guide,UCw185nSrRQ8kW1uFO4l0CFg,AppFind,Get a Ring Video Doorbell: https://www.amazon.com/Ring-Video-Doorbell-Satin-Nickel-2020-Release/dp/B08N5NQ869/?,2023-09-08T18:04:15Z
PnrCMRHpG0k,Nikon D3200 in 2025 - The best camera for beginners?,UCinrk7Ol2FtRSn4daFgTc9w,BoostLeekd Media,"Is it still a good camera? YES! Is it better than the D3100? YES! 20 months after the release of the D3100, this is what the D3100 ...",2024-12-02T01:41:12Z
KrCPd4inRu0,My Camera Settings For Canon M50 Street Photography &amp; Tips for Beginners,UCofQi1czlsqBKWK28ZlIywg,hams nocete,Watch my Street Photography POV videos here: https://youtube.com/playlist?list=PL69f3SCh8739V8Kn3M9cmzCcjz5q7Zpo3 In ...,2021-01-26T13:00:15Z
4pHfAca08GI,📸 Best Wedding PORTRAIT PHOTOGRAPHY Camera Settings for Beginners - PORTRAIT PHOTOGRAPHY in Bengali,UC8l8J5kbbQDJT6mHM-cy2zQ,Click Nil,"In today's video, we're revealing the secret camera settings that will help you to capture portrait photos , especially during ...",2024-06-02T13:55:55Z
2VRgiyNO5qU,Mobile Photography For Beginners : Grid Lines,UC1YKAzhWdJiimN7K2xHwcRw,SimpleNCreative,Mobile Photography For Beginners : Grid Lines #mobilephotography #professionalphoto About video: This shorts video is about ...,2022-02-17T09:45:00Z
hO7yAZ1rUwg,An Instant Camera for Beginners?,UCrQsI7_xePmqZujb2BdsfmQ,Not A Review,Camera Link: https://amzn.to/43zSq3y Film Link: https://amzn.to/3WPnbPv Fujifilm's Instax Mini 9 Instant Camera Lens Focal ...,2023-06-05T12:39:03Z
AzQvieaIymE,FOOD PHOTOGRAPHY For Beginners (Full Process Explained),UCmpPHYfKRyJ8RN7OooyL4Cw,Takumi Shyegun,Discover the full production process of shooting food photography for a paying client Watch my FREE photography ...,2022-09-29T11:41:33Z
CmDqwdIZf5I,"ICM Photography for beginners. YOU MUST TRY THIS - it&#39;s easy, fun and can be artistic",UCO9MaYl_fxp8a8miS2dd7zg,Tony Howell,INTENTIONAL CAMERA MOVEMENT FOR BEGINNERS. ICM is really easy to do when you know the basics. Ideas for improving ...,2024-06-14T15:00:19Z
GnvFqVAtzQA,Fujifilm X100F for beginners | user guide | tutorial | best settings | movie mode | English,UCd3cgj_5uenf87b56sKmEew,the daniel life,LINK TO PRODUCT ### http://www.gmfoto.de/fujifilm-x100f-silber.html (camera in silver) ...,2018-02-09T14:02:38Z
1dbQoqSXqlo,"learn photography | photography for beginners | How to use aperture, shutter &amp; ISO settings",UCYxNt2TL6ldaAgch-qcwxjg,Taruun R Jha PHOTOGRAPHY,"learn photography | photography for beginners | How to use aperture, shutter & ISO settings Here is the 4th video from my ...",2020-11-22T13:30:13Z
qhc5uFlv5Pk,Dji action 2 complete beginners guide🔥🔥🔥,UCy36JccoT_ToxOTajO_L6xQ,Technology Simplified ,DJI action 2 power combo without protective magnetic case beginners guide in Hindi Searchable terms dji action 2 dji action 2 ...,2024-03-02T09:50:09Z
B0J27sf9N1Y,Blender Tutorial for Complete Beginners - Part 1,UCOKHwx1VCdgnxwbjyb9Iu1g,Blender Guru,Let's make another donut   Watch Part 2: ...,2023-11-16T06:25:53Z
lARzqJ5Dbbw,Nikon d7500 wedding photoshoot || 18-140mm lens // photography tips || beginners photoshoot #shorts,UC3spDmCvqkZHDCsgMWCzFtw,Kaimur Photography,Nikon d7500 wedding photoshoot || 18-140mm lens // photography tips || beginners photoshoot #shorts #viral #ytshorts ...,2023-02-19T06:49:22Z
490sEFqmwXE,Best Budget Cameras for Beginners in 2025,UCCVyGW9Rf8b5Puldlem_6cg,The Film Alliance,Take my FREE CAMERA or LENS QUIZ to see which camera is right for you - https://geni.us/37Efgsx PGYTECH OneGo Solo ...,2024-03-27T16:14:41Z
izTDbJ23_ws,7 CREATIVE GIMBAL MOVES - Epic SHOT IDEAS for CINEMATIC VIDEO - DJI RS3 - Camera Movement,UCORWSNfpO9swM1FPP0BC_OQ,Jacques Crafford,7 CREATIVE GIMBAL MOVES - Epic SHOT IDEAS for CINEMATIC VIDEO - DJI RS3 - Camera Movement MY FILMMAKING ...,2022-06-30T15:30:30Z
FMgl42c99zw,New Update 3.8 Best Settings &amp; Sensitivity to Improve Headshots and Hip-Fire ✅❌ | PUBG MOBILE / BGMI,UC2YdNTt3Uxi-FxvVnqkfE7w,RUBY,"Welcome to the ultimate PUBG Mobile Update 3.8 settings and sensitivity guide! Celebrating PUBG Mobile's 7th Anniversary, ...",2025-05-08T08:18:14Z
huSQJ0pQdgw,Camera Settings for Beginners - Air 2S D-log Color Grading (Part 1),UCocU5NrxRFkEKaICElOnpsA,Chad B.,Getting your camera setting correct is just as important as the Color Grading part of it. Something many beginners may overlook.,2021-11-07T17:43:56Z
N3y78MKei90,Camera setting in 3d max for beginners | 3ds max Basic,UCFCsvUEGfISLUP9RlhSS45w,3Diment,how to setting camera in 3d max for beginners.,2021-06-22T02:06:24Z
GSiyn8NTlTE,DJI MIC MINI Beginners Guide - Start Here,UCFIRm1Fv1VC4DZxmYyvNOTQ,Jeven Dovey,Get the DJI MIC Mini: https://geni.us/crfa Graded with these Adventure LUTs: https://geni.us/BqN1X Learn how to be an ...,2024-11-26T16:40:37Z
gLD38bLE1O0,Best OBS Studio Settings for STREAMING in 2025 (For Beginners),UCK2Kdh5cnoVoIfu8i6Wh2Tw,Cpaws Music,FREE STREAMER'S MASTERCLASS▹ https://go.cpawsmusic.com/masterclass STREAMER STARTER PACK (20% OFF)▹ ...,2024-10-25T14:02:00Z
0q8gq-hFjXg,Photography best camera settings for beginners in Hindi  step- 4,UCQ7j9lW3W46Y0aUsUSvdRMA,Ajay Mds Photography,Welcome to our youtube channel Ajay Mds Photography You tube Chanel https://www.youtube.com/c/ajaymdsphotography ...,2020-05-11T04:20:00Z
BWcFJ1vJ1SY,"BEST CONTROLLER AIM SETTINGS IN FORTNITE🔥 (PS5, XBOX, PC, SWITCH)",UCqq90mrL_x3SKW4MxJUGjdw,Zams,USE CODE “WGCBUG” IN THE ITEM SHOP   #ad 1v1 map with my settings: 7263-9510-1289 Socials: Twitter: ...,2025-05-06T15:00:17Z
MwzpN47B-x0,Basic Camera settings for Beginners।। DSLR কেমেৰা কেনেকৈ চলাই ।। Assamese Vlog ।। Royal Radiant,UC_ns1zsqMcNfRG_Cq5zVPjg,Royal Vlogs,"Hi Guys, in this video I'm trying to show you how to capture photos in daylight with the basic setting of a DSLR or Mirror less ...",2022-08-07T14:52:12Z
DTPH13r5haQ,DJI FLIP Beginners Guide - Start Here,UCFIRm1Fv1VC4DZxmYyvNOTQ,Jeven Dovey,More info on the DJI Flip: https://geni.us/WFpi6 Download my FREE Drone Move Cards: https://geni.us/4HSL Graded with these ...,2025-01-15T14:31:16Z
8kecTEwE1aI,Choosing What Your Camera Focuses On | Auto Focus for Beginners Part 2,UCGUSrx8dZxHVfpl5sI8CI8g,Matt Johnson,In this short video I show you how to choose what your camera focuses on when using auto focus. This video uses a Canon EOS ...,2021-02-17T18:17:04Z
vcJbJC0XAOM,Nikon D5600 Camera Best Settings For Beginners,UCUVya50ULEEpyYtFkq9BO5g,Papai  Photography,NikonD5600 #Photoshoot #Camerasetting NikonD5600 Camera Setting in Bengla. I Like and share the video if you enjoyed!,2021-08-21T04:43:14Z
58mRObDpor0,GoPro Hero 13 Black | Complete Beginners Guide &amp; Best Settings,UCukwLTafLowiyytSJcBxfZg,Great Day For A Hike,This video provides a complete beginners guide to what you need to know for getting started with the GoPro Hero 13 Black action ...,2024-09-15T11:32:53Z
5eWcvKE9Tmo,Professional Moto-Vlogging Setup Built from Scratch for Beginners | 2025,UCXjG4Q0K1QLDmN0McSuNrpQ,The 101 Rider,PURCHASE LINKS: ⬇️ Helmet: https://amzn.to/4gdbuu4 - GoPro Hero (Camera): https://amzn.to/4hb1O4y - Microphone: ...,2025-01-26T05:00:02Z
TxlDNSEgtA8,Sony Alpha 6400 How To Use For Beginners - All Camera Settings For Photography &amp; Video Work - A6400,UCbE2LIb14kZSTbLvxqUIjYA,Techy Dada,How to use Sony A6400 Camera - full settings for beginners. Check it out on Amazon: https://tapthe.link/SiMhK2cGL If you want to ...,2022-04-16T11:21:31Z
jWDtaXYsGwE,How to photograph fireworks : 10 Essential tips for beginners,UC9lyUdwosxq_OxC1uggjUPA,Photo Genius,"In this video I share tips, camera settings and more so you can take amazing firework photos. This tutorial is perfect for the ...",2021-07-29T10:30:15Z
Ui3WkUnviyk,DJI Osmo Action 5 Pro | Complete Beginners Guide &amp; Best Settings,UCukwLTafLowiyytSJcBxfZg,Great Day For A Hike,"This video is a complete beginners guide to the DJI Osmo Action 5 Pro. In this video I unbox the Action 5 Pro, show you how to ...",2024-09-25T10:00:36Z
R-PFTqo3g8I,DSLR Buttons for Beginners Malayalam | DSLR Basics Malayalam | Photography Malayalam|Nikon Malayalam,UCjAgyRHTt4T9kIKlzVHuRaA,Executive Malayali,Photography malayalam. DSLR Basics Malayalam Amazon similar product - https://amzn.to/3BbSRmZ.,2021-08-20T05:00:08Z
1c2xKX3OiAQ,DJI Mini 3 The Ultimate Guide for Beginners - Getting Ready For First Flight,UCoKMBuQ8YejlCbNm77ZL8jg,Air Photography,DJI Mini 3 (USA) https://amzn.to/3iLxmEN DJI Mini 3 (CAN) https://amzn.to/3WbnNxD This is my beginner's guide for the new DJI ...,2022-12-18T23:21:30Z
FX5JMHlmMQc,"DJI Mic Mini Tutorial for Beginners: How to Setup, How to Pair, How to use DJI Mic Mini",UCxDJbNtgLYUwjPg_xYjvSwQ,Otto Julian,"DJI MIC MINI easy step by step tutorial. quick guide, how to setup, how to pair with Pocket 3, Action 5, GoPro 13, Insta360 Ace Pro ...",2024-11-29T15:41:41Z
VWb1C0Jr5e0,OM System OM-3 User Guide for Beginners: How to set up your Camera - English,UCUk4AZKECoHCXAs82jBQLag,Kempetenz,This is a user guide for quickly setting up your OM System OM-3 Camera. 0:00 Start and navigate with the wheels 0:25 Reset and ...,2025-04-16T13:30:34Z
JbON4OjImwE,DJI RS4 Mini Beginners Guide - Start Here,UCFIRm1Fv1VC4DZxmYyvNOTQ,Jeven Dovey,Graded with these Adventure LUTs: https://geni.us/BqN1X Learn how to be a ADVENTURE CREATOR: ...,2025-03-05T16:01:33Z
aHISF71gDRY,NEW WARZONE Aim Assist Settings Make Controller Players Overpowered! 🎮 (BO6 Best Settings),UCLxrpY1bD6p_FNq749NraRQ,Chuck,NEW WARZONE Aim Assist Settings Make Controller Players Overpowered! (BO6 Best Settings) | Chuck Subscribe to Me: ...,2025-05-09T00:57:06Z
4-ylodbPsGM,Insta360 X4 Beginners Guide And Insta360 App Editing Tutorial,UCeqky0tc84Ezl0CYMW3xKkA,Best360,FREE DOWNLOADS ➡️ Insta360 X4 Best Settings Cheat Sheets: https://bit.ly/4lioClh ➡️ Insta360 X3 Best Settings Cheat ...,2024-04-16T13:00:07Z
lWTMFEoDbkY,Canon 2000D   Video Mode Dslr - Best setting  for video | Quick Beginners#photography #canon2000d,UCjyfuBMN_mtUPwpgK7IhDXQ,Aiza world Dubai🇦🇪,canon2000d This beginners guide is for newly using canon 2000d will show you how to set best canon 2000d to movie mode and ...,2022-05-12T11:08:54Z
N4bnUHUlylo,15 No Hesi Tips/Mods for Beginners - Get Certified in 2024!,UCReTbro3N-uqwbWdVOezcbg,Sleepers,In this video I explained all the tips and mods that helped me earn the certified status on No Hesi! This is No Hesi in Assetto Corsa ...,2023-12-21T17:00:15Z
E2ALdDP6P7s,Insta360 X5: The BEST Settings,UCGMG3fuzCNOPgRYfSBTJR7g,The TechPacker,Get your Insta360 X5 here: https://bit.ly/SarbJohal-X5 — be among the first 20 purchasers and receive an exclusive FREE ...,2025-05-11T15:00:32Z
JTEAJS9Rr6E,CAMERAS - Everything you need to know 📷 Simply learn Photography for Beginners Course | Jaworskyj,UCpiFxTH1J_12oc5eaNorYfg,Benjamin Jaworskyj - Simply Learn Photography,Get the full 4 hours photography course for beginners today ...,2024-10-18T23:00:08Z
PZZha2Ld9tw,DRONE NIGHT PHOTOGRAPHY for beginners - Tips and camera settings explained,UCT4Y7wsSZ8jTeDwgxIkjj1A,Drone Captured Moments,A beginners guide to taking amazing photos at night - I share tips to help you capture amazing low light photos with your drone.,2022-05-18T22:38:39Z
3QKBjXVbisk,Nikon Z50 Review in Telugu | Best Camera for Beginners &amp; Travelers | Telugu Photography Vlogs,UCoAgWm7qF2Tlckzy4yW7qJw,Telugu photography vlogs,Nikon Z50 Review in Telugu | Best Camera for Beginners & Travelers | Telugu Photography Vlogs Full HD and 4K capable UHS i ...,2025-01-11T02:30:02Z
FCd80y07PXQ,Best Camera Settings for Portrait Photography !,UCL0CykAC1D6Pz8KJHVK1eIw,TCM Reviews,Best Camera Settings for Portrait Photography | Complete Beginner to Pro Guide Want to take stunning portrait photos that look ...,2025-05-12T17:03:04Z
fAZZLPwbPyg,DJI Mini 4 Pro Complete Beginners Guide - Getting Ready For Your First,UCoKMBuQ8YejlCbNm77ZL8jg,Air Photography,DJI Mini 4 Pro: https://bit.ly/48s2f6x This is my beginner's guide and tutorial for the DJI Mini 4 Pro. This training guide is geared ...,2023-09-27T11:42:34Z
DFd3O72WL-I,2025 World Best Sensitivity Settings 🔥 For All Mobile Non Gyro And Gyroscope ✅ | PUBG MOBILE |,UCoHf4D-_GIN1aJjSiVEnQYQ,Gb Alpha,About This Video Hi Guys In This Video I will Share how to make Owen Pubg Sensitivity Settings Please Don't Forget To ...,2025-05-05T09:00:16Z
-XJuTU-a_98,DJI Action 2 Beginners Guide &amp; Tutorial,UCoKMBuQ8YejlCbNm77ZL8jg,Air Photography,"If you have just purchased the new DJI Action 2 and want to learn how to use it, our beginner's guide and tutorial is a great place ...",2022-01-02T15:37:47Z
XajiIDSdmns,How to Use a DSLR Camera | Beginners Guide in Hindi ! ft Angad Kahai Singh,UCXUJJNoP1QupwsYIWFXmsZg,Tech Burner,Dslr Camera seekhna hai to ye video dekh lo! Sab Samajh aa jaega! Subscribe To Angad ...,2018-06-14T12:24:19Z
rO-5esxuG5Q,DJI Air 3S BEGINNERS Setup Guide | 8 Steps,UC0h_KX-PqXYfFDy6Fe_UiCA,Flying Filmmaker,Instantly unlock my FREE Drone Filmmaking Training ...,2024-10-18T15:53:16Z
3xAvG7sPDIY,How To Setup CCTV Camera With DVR and Monitor Connections Beginners Tutorial,UCKnLFRzGLIE6E9VlfUaUhRQ,Media Creation Club,"in This video, You will Learn How to do a CCTV camera Connection with DVR I hope you will like this Video, and How To Setup ...",2024-10-27T14:01:09Z
U24jDyYnU3A,Insta360 Studio Beginners Tutorial 2025: Edit &amp; Reframe 360 Videos Like A Pro!,UCAjSHLRJcDfhDSu7WRpOu-w,Ben Claremont,Ready to master 360 video creation? Join 360 Video 101 — my complete beginner-to-pro course ...,2024-11-27T23:57:04Z
n7Enc_TE_jA,"Camera Basics for Beginners: ISO, Shutter Speed &amp; Aperture Explained!",UCIkysK6UENlMYLuTkVbLQyg,Kevin Kabore,"If you've ever wondered what ISO, shutter speed, and aperture actually do—this is the video for you. I break it all down in a simple, ...",2025-05-12T13:01:22Z
O--YJHVMyT0,How to Gimbal Balance PERFECTLY 2024 | COMPLETE Beginners,UCT7N5Zn9YSF1IQcc4-fRM5A,The GRY India,Balancing & Gimbal for Smooth and Cinematic Video Download Lut's : http://bit.ly/3Ww1kLc Instagram ...,2024-04-07T04:21:39Z
eO2uzrEPYXI,camera settings to blur background | basic dslr photography tips for beginners,UCXlIvD6MtbHB7YhP3vudmHQ,Maneesh Saxena,In this beginners dslr photography tips and tricks Hindi tutorial i am sharing easy techniques to blur background with any Nikon ...,2018-12-03T04:22:32Z
OAh2U3JApw8,Best PORTRAIT PHOTOGRAPHY Camera Settings for Beginners,UCeRR3gl2xCB68ZO7O_z7cmA,Kunal Malhotra,Learn Photography with me: https://bit.ly/kunalmalhotraYT 📽️ Adobe Lightroom Masterclass: https://bit.ly/LightroomWithKM ...,2022-03-20T12:45:01Z
VUCPznpejI8,Adobe Lightroom Full Tutorial for Beginners 2025 | Under 20 MINUTES!,UCtsEZAcluPY-E6yWJrlX34A,Ayitsphotography,"My LIGHTROOM Presets: http://ayitsphotography.gumroad.com/ As I am for the most part a Lightroom creator, here is a full ...",2024-01-17T20:00:13Z
RyeyBsn3pa8,canon 200d mark ii best settings for beginners,UCawj2-E3fIYuJOzQ4j6kpuw,D4R Studio,Hi I Am Dharmesh Patel. Welcome to Our YouTube Channel D4R Studio. About this video- Dosto Aaj Ki is Video Me Maine canon ...,2022-10-29T15:48:15Z
F_vbaT26tUg,Photography tutorials for beginners in Hindi | Nikon beginners guide | Best Camera Settings |,UCoXZ74h6SFsrvuJbY0PGqlQ,Dipankar Bakshi Photography,This video series is all about Photography tutorials for Nikon DSLR users. Specially for beginners in Hindi. in this video series I am ...,2019-08-22T13:34:51Z
gNXGb8cZumY,DJI Mini 3 Pro: The Complete Beginners Guide,UC6y_DbpezOinlzHv8O092zw,DC Rainmaker,"Here's your massive DJI Mini 3 Pro complete beginners guide, covering end-to-end all the features, including both the DJI RC as ...",2022-05-12T12:32:10Z
Vu23YTS3n_0,Basic Camera Settings For Photography Beginners,UCrlpRJEV71CLDHchOP3AKAQ,NADISHKA,"Did you recently purchase a new camera but are not sure which camera settings to use? It's okay... In this video, you can learn the ...",2021-07-26T18:03:30Z
bY5gXe5T6yg,Sony DSC WX500 Tutorial for Beginners,UCWFkFzEqVZpvF9LDM9kzwyw,Ideas Creations Inventions,Buy a Sony camera (affiliate link): ...,2021-09-18T10:53:09Z
ZBoZeI-4w8s,GoPro Hero 12 Black | Complete Beginners Guide &amp; Best Settings,UCukwLTafLowiyytSJcBxfZg,Great Day For A Hike,This video provides a complete guide to what you need to know for getting started with the GoPro Hero 12 Black action camera.,2023-09-17T20:38:47Z
5GCEKCMkUCs,MT-15 Mileage Test: Everything You Need to Know- #mt15 #milagetest #shorts,UCxT3GZnKF05qUgYn67jTPuA,Karan Nishad vlogs 43,MT-15 Mileage Test: Everything You Need to Know- #mt15 #milagetest #shorts nikon d3500 vs d5600 nikon d5600 comparison ...,2025-05-05T04:30:03Z
u_qCh3TIk8w,Audio Interface Setup For Beginners | A 4-Step Process For Virtually Any Interface,UCH3_Mmyv5OFV0vkyF1tz_Iw,Audio University,"If you need some help setting up your audio interface, you've found the perfect video. I'll help you get your audio interface ...",2021-09-09T10:00:34Z
gB0Bak4QMHo,9 Must Know Camera Settings For Pro Level Photoshoots ( Works on Any Camera ),UCXlIvD6MtbHB7YhP3vudmHQ,Maneesh Saxena,we break down the 9 essential camera settings every beginner photographer needs to master for professional and commercial ...,2025-05-11T09:16:46Z
csURVFYDWMQ,BUDGET OFF CAMERA FLASH SETUP FOR BEGINNERS // YONGNUO YN560 IV Wireless Flash,UCRMeJl4EJi6nxULZzPdLiug,James Del,"In this video I show you the cheapest way to build a 1 light off camera flash set up. For my shoots, I don't always have the time to ...",2023-01-29T23:43:05Z
ULoSqGNzcdk,Auto Zoom for Beginners 🎥 | Start with Factory Settings &amp; Learn as You Go!,UCo671uh-2D5IpX4H-nBAFTQ,OptiBooster: Level Up Your Life,Just getting started with your camera? Don't stress—factory settings are your friend! If you're a new content creator or just ...,2025-04-24T14:00:41Z
96FZxIDsC-o,Sony ZV-E10 Photography Settings for Beginners telugu | Step-by-Step Guide | km creative zone,UCrq7DRYCcJkvsuC2JGIM4Aw,km creative zone,"Are you a beginner looking to capture stunning photos with your **Sony ZV-E10**? In this video, we break down the essential ...",2025-04-14T11:34:19Z
I8nVOKQLTnk,"DJI RS4 Mini TUTORIAL Guide for Beginners: How to balance, setup and use the gimbal and tracking",UCxDJbNtgLYUwjPg_xYjvSwQ,Otto Julian,"How to use DJI RS4 Mini, How to Balance DJI RS4 Mini. How to use tracking module RS4 Mini, Activation, Setup, Menus, ...",2025-03-24T13:30:10Z
o0BLS0GOyAI,Complete iPhone Camera Guide for beginners - Hindi ||  iPhone 13 pro complete camera guide in hindi,UCHQQP1tLQIT372OrquzBOzA,Ira's World,iphone #camera #guide I hope you will like this video Subscribe to my 2nd Channel https://bit.ly/2UN4WhO How to Jailbrerak ...,2022-02-06T07:10:22Z
AZWorRFcUKc,How To Setup The PERFECT Home Network For Beginners,UC7Wy-UuuwOqHxu4JeVWVX4g,Steve DOES,Look For More Of My Content Here - https://bit.ly/45yyC1U ▻ Playlist My Home Network Setup Guide - From Basic to Beast Mode ...,2024-05-11T13:00:15Z
yK4XL3L6dDQ,TOP 10 BEST Settings In Delta Force Mobile - Delta Force Tips &amp; Tricks,UCBgIxCjIfkSHuwCUajbQEuA,GAMErHyNas,TOP 10 BEST Settings In Delta Force Mobile - Delta Force Tips & Tricks Delta Force Mobile Tips Delta force mobile Settings Delta ...,2025-05-10T14:40:52Z
JejvpXFaqqQ,DJI FLIP TUTORIAL GUIDE for Beginners: How to Setup and How to Fly,UCxDJbNtgLYUwjPg_xYjvSwQ,Otto Julian,"DJI FLIP Tutorial for Beginners. How to setup and fly the drone with automatic flight modes, smartphone or RC2 controller - Easy ...",2025-02-07T14:00:28Z
ZdHLDgxhzOc,Insta360 X5 Fake Drone Shot Tutorial | Easy Trick Shot for BEGINNERS,UCaLCRvvau4acqQ4eLGZUywA,JORDAN HETRICK,5 Easy Steps to make Fake Drone shots together with the Insta360 X5 (or X4)! I'll show you how to capture surprising Fake Drone ...,2025-05-10T15:43:34Z
VzErFY8gzVw,Beginners guide to CONTROLLER SETTINGS in MX BIKES!,UClb648pCJJfPAVaITPWyj2Q,REAPERDOC,Beginners guide to CONTROLLER SETTINGS in MX BIKES! In this video i go through EVERY controller setting in mx bikes and try ...,2024-12-16T21:30:04Z
xNbCLguuDH4,Best DSLR camera settings for photoshoot in telugu||photography basics for beginners|| TELUGRAPHY,UC1IN19XXnDnJ06pQOYZG8Og,TELUGRAPHY HARSHA,Best DSLR Camera settings to the normal people for photoshoots.This video is very helpful for those people who take camera for ...,2020-04-12T12:30:38Z
2qMhL1zC0w4,"Insta360 Flow Beginners Guide | Set Up, Settings, Modes Explained",UCeqky0tc84Ezl0CYMW3xKkA,Best360,Insta360 Flow ...,2023-03-29T13:00:03Z
h2DetwVCICM,Top 10 Delta Force Mobile Settings You MUST Change NOW!,UCj_paku3Qlgm8daSGP0jYHg,2Noob4U,DeltaForce #DeltaForceGame #DeltaForceCreator Just downloaded Delta Force Mobile and not sure what settings to use?,2025-04-22T18:17:06Z
CW8hDvJOwGM,Unreal Engine 5 Cinematic Camera Tutorial for Beginners STEP BY STEP,UC9mi7i2_KEthCozkAFz3AgA,EZ Unreal,"Heeyo and welcome! Today, I've got an exciting tutorial for you on Unreal Engine 5.2, perfect for beginners who want to dive into ...",2023-05-29T19:34:19Z
e8ODSJ73IsY,Beginners Dream Camera? Sony a6400 Review (తెలుగులో)  #photography #camera #review #telugu #youtube,UCr00OUZJSyLSAO0RkZKIydw,victoryvikas,"In this video I explained about Sony a6400 camera The Sony Alpha a6400 is a fantastic camera for YouTube content creators, ...",2024-10-20T11:18:37Z
bQpNYGhPR1w,SONY NX100 BASIC KNOWLEDGE &amp; SETTINGS FOR BEGINNERS,UCDc3ouvM_5NHfonviO-zHVQ,ST You Studio,SONY NX100 BASIC KNOWLEDGE & SETTINGS FOR BEGINNERS #sonycamera #basicknowledge #nx100 #settings #foryou ...,2023-09-16T12:30:31Z
8iRUYz9O-ok,Nikon Z30 Tutorial : Camera Button &amp; Function | Tutorial for Beginners । जाने सभी फंक्शन Hindi,UCxG5J9YJdAYUbN_ycenK5eQ,RJ Tech Buddy,Nikon Z30 Tutorial : Camera Button & Function | Tutorial for Beginners । जाने सभी फंक्शन Hindi #nikonz30 ...,2022-07-22T13:30:02Z
Smzav-x0Xjw,DJI MINI 4 PRO❗ DRONE FLY 🕊️ Professional 4k With Super Bike🔝❤🔝 #shorts,UCF4yoPCBn0N3Vrfyq2QMNng,Advance Explore ,DJI MINI 4 PRO❗ DRONE FLY 🕊️ Professional 4k With Super Bike  ❤   #shorts Your Queries ✓ dji mini 4 pro dji mini 4 pro ...,2025-05-11T02:00:34Z
WXd7eJqpJQ4,Nikon Z fc Photography Settings Hindi | Z fc Settings for Beginners |,UCxG5J9YJdAYUbN_ycenK5eQ,RJ Tech Buddy,Nikon Z fc Photography Settings Hindi | Z fc Settings for Beginners | #nikonsettings #nikonzfc #nikonzfcsettings इस विडियो ...,2022-06-17T13:30:09Z
obxSZ1TG8xk,SECONDLIFE PS FOR BEGINNERS EP1 | Best Camera Settings for Quality Photos,UCUWF1GH974PdvEK_0Fu9EdQ,Whisper Mizin,Hi Friends - In this series I'll go over some easy fixes for your photos within second life using Photoshop. In this episode we ...,2022-04-16T21:48:50Z
iXuJCYpvvJ4,Secret One Tap Headshot Trick &amp; Setting🔥 || Free Fire #shorts || FireEyes Gaming,UCS5eXe20W1hq0rHsDoYHGqg,FireEyes Gaming,Secret One Tap Headshot Trick & Setting   || Free Fire #shorts || FireEyes Gaming Short video | Free Fire #shorts.,2025-05-04T15:20:48Z
6SmQhSh46Lw,Insta360 Flow 2 Pro for beginners,UCd3cgj_5uenf87b56sKmEew,the daniel life,AFFILIATE LINKS ••• https://www.insta360.com/sal/flow-2-pro?utm_term=INR2JL3 ✓ Insta360 Flow 2 Pro ...,2025-02-09T19:00:06Z
8J3jSiTq2_0,Unleashing MINIATURE Magic with Poteto Photography! #shorts,UCwKPOImuAFLgzofmoveM1eQ,Handy Photography,Unleashing MINIATURE Magic with Poteto Photography! Get ready to be amazed by the miniature magic of Poteto Photography!,2025-05-12T05:01:45Z
